{
  "schema": "inside-valdivia.compatibility-lock/1",
  "captured_at": "2026-08-28T21:11:57Z",
  "components": {
    "cauce": {
      "repository": "https://github.com/hypereikon-lab/ComfyUI-Cauce",
      "version": "5.4.2",
      "commit": "fc64df6c13f9de17abc44637453bd2c0629f755f",
      "tree": "f64189fa6581770ff182a123da4046e9eed81d58",
      "metadata_sha256": "855c351cb6de8c8babf02dda27c4f3b189800c743be7c8f99cef7ddfe7da11a8",
      "distribution": "registry-prepared-unpublished",
      "registry_node_id": "cauce"
    },
    "runtime_control": {
      "repository": "https://github.com/hypereikon-lab/ComfyUI-Runtime-Control",
      "version": "0.5.0",
      "commit": "37ac10f762dc6bcf229e0e26d21ef96a67a018dd",
      "tree": "1583166f2069fa7d58bcb50928f4ed845204f1f9",
      "metadata_sha256": "39ba9f46d5b5d2e9caac3696d54e09f85fd55dee40839923108aea60ca9abc7c",
      "distribution": "source-package",
      "registry_node_id": null
    },
    "workspace_control": {
      "repository": "https://github.com/hypereikon-lab/ComfyUI-Workspace-Control",
      "version": "0.4.0",
      "commit": "2f9174e61ae911c1573a26b64e5ee4aa80527b0e",
      "tree": "c66864a9c27349ace2a195e8dd2318d5fc837427",
      "metadata_sha256": "ed3184a28a581eaaed5df13ca08eeb3b342ce4d6de481606a16ca6ae70ce1d98",
      "distribution": "registry-prepared-unpublished",
      "registry_node_id": "workspace-control"
    }
  },
  "platform": {
    "core_profile": {
      "minimum_comfyui": "0.33.0",
      "basis": "last-live-schema"
    },
    "full_profile": {
      "minimum_comfyui": "0.34.0",
      "basis": "official-addguide-and-per-token-h3-mask-release"
    },
    "frontend": {
      "last_live_tested": "1.49.6",
      "next_compatibility_target": "1.53.2",
      "target_state": "requires-live-diagnostic"
    },
    "manager": {
      "last_live_observed": "V3.41",
      "first_install_policy": "public-registry-or-journaled-public-git-only"
    }
  }
}
